{
  "model_version": "0.1.0",
  "model_family": "inc17b2c-identity-cross-source-candidates",
  "atlas_admitted": false,
  "items": [
    {
      "id": "WG17B2C-VA-VHA",
      "name": "Veterans Health Administration",
      "kind": "organizational_component",
      "role": "administration",
      "jurisdiction": "federal",
      "canonical_parent_id": "ORG-FED-EXE-DEP-VA",
      "source_local_subject_id": "WG17B2B-SUB-VA-VHA",
      "prior_provisional_candidate_id": "DEPT04-UNIT-VA-VHA",
      "statutory_relation_id": "WG17B2B-REL-VA-VHA",
      "publisher_observation_id": "WG17B2B-OBS-VA-VHA",
      "statutory_evidence": {
        "key": "VA-301",
        "original_url": "https://uscode.house.gov/us/usc/119-124/t38/s301/",
        "original_path": "evidence/inc17b2b-olrc-119-124/originals/sha256/2bd005d9ce671a2605f56d7b75d5f0217f9cde1859398b1a8615bd61ba75672b.html",
        "sha256": "2bd005d9ce671a2605f56d7b75d5f0217f9cde1859398b1a8615bd61ba75672b",
        "git_blob_sha1": "5d890f8ccefb0be028df9ad9cf433f9995aa671d",
        "anchor": "Veterans Health Administration"
      },
      "directory_evidence": {
        "key": "VA-ADMIN-OFFICES",
        "original_url": "https://department.va.gov/administrations-and-offices/",
        "original_path": "evidence/inc17b2b-olrc-119-124/originals/sha256/4a1bdeb313e1a35732d5b2df7cbdb5ebe30647b4b502adfa6daef4b543575edb.html",
        "sha256": "4a1bdeb313e1a35732d5b2df7cbdb5ebe30647b4b502adfa6daef4b543575edb",
        "git_blob_sha1": "5bcf750c6bdda6d4a3bc059496dde386cdea85e7",
        "anchor": "Veterans Health Administration"
      },
      "statute_locator": "38 U.S.C. 301(c)",
      "statute_law_through": "2026-10-15",
      "directory_observed_at": "2026-10-26",
      "legal_effective_from": null,
      "legal_effective_to": null,
      "predecessor_id": null,
      "successor_id": null,
      "historical_aliases": [],
      "directed_membership": {
        "kind": "statutorily_part_of",
        "from": "WG17B2B-SUB-VA-VHA",
        "to": "ORG-FED-EXE-DEP-VA",
        "reverse_query": "has_statutorily_named_constituent",
        "note": "Derived research projection from source text, not an admitted legal edge"
      },
      "qualification": "cross_source_text_and_name_correspondence_only",
      "independent_legal_review": false,
      "canonical_component_id": null,
      "atlas_admitted": false
    },
    {
      "id": "WG17B2C-VA-VBA",
      "name": "Veterans Benefits Administration",
      "kind": "organizational_component",
      "role": "administration",
      "jurisdiction": "federal",
      "canonical_parent_id": "ORG-FED-EXE-DEP-VA",
      "source_local_subject_id": "WG17B2B-SUB-VA-VBA",
      "prior_provisional_candidate_id": "DEPT04-UNIT-VA-VBA",
      "statutory_relation_id": "WG17B2B-REL-VA-VBA",
      "publisher_observation_id": "WG17B2B-OBS-VA-VBA",
      "statutory_evidence": {
        "key": "VA-301",
        "original_url": "https://uscode.house.gov/us/usc/119-124/t38/s301/",
        "original_path": "evidence/inc17b2b-olrc-119-124/originals/sha256/2bd005d9ce671a2605f56d7b75d5f0217f9cde1859398b1a8615bd61ba75672b.html",
        "sha256": "2bd005d9ce671a2605f56d7b75d5f0217f9cde1859398b1a8615bd61ba75672b",
        "git_blob_sha1": "5d890f8ccefb0be028df9ad9cf433f9995aa671d",
        "anchor": "Veterans Benefits Administration"
      },
      "directory_evidence": {
        "key": "VA-ADMIN-OFFICES",
        "original_url": "https://department.va.gov/administrations-and-offices/",
        "original_path": "evidence/inc17b2b-olrc-119-124/originals/sha256/4a1bdeb313e1a35732d5b2df7cbdb5ebe30647b4b502adfa6daef4b543575edb.html",
        "sha256": "4a1bdeb313e1a35732d5b2df7cbdb5ebe30647b4b502adfa6daef4b543575edb",
        "git_blob_sha1": "5bcf750c6bdda6d4a3bc059496dde386cdea85e7",
        "anchor": "Veterans Benefits Administration"
      },
      "statute_locator": "38 U.S.C. 301(c)",
      "statute_law_through": "2026-10-15",
      "directory_observed_at": "2026-10-26",
      "legal_effective_from": null,
      "legal_effective_to": null,
      "predecessor_id": null,
      "successor_id": null,
      "historical_aliases": [],
      "directed_membership": {
        "kind": "statutorily_part_of",
        "from": "WG17B2B-SUB-VA-VBA",
        "to": "ORG-FED-EXE-DEP-VA",
        "reverse_query": "has_statutorily_named_constituent",
        "note": "Derived research projection from source text, not an admitted legal edge"
      },
      "qualification": "cross_source_text_and_name_correspondence_only",
      "independent_legal_review": false,
      "canonical_component_id": null,
      "atlas_admitted": false
    },
    {
      "id": "WG17B2C-VA-NCA",
      "name": "National Cemetery Administration",
      "kind": "organizational_component",
      "role": "administration",
      "jurisdiction": "federal",
      "canonical_parent_id": "ORG-FED-EXE-DEP-VA",
      "source_local_subject_id": "WG17B2B-SUB-VA-NCA",
      "prior_provisional_candidate_id": "DEPT04-UNIT-VA-NCA",
      "statutory_relation_id": "WG17B2B-REL-VA-NCA",
      "publisher_observation_id": "WG17B2B-OBS-VA-NCA",
      "statutory_evidence": {
        "key": "VA-301",
        "original_url": "https://uscode.house.gov/us/usc/119-124/t38/s301/",
        "original_path": "evidence/inc17b2b-olrc-119-124/originals/sha256/2bd005d9ce671a2605f56d7b75d5f0217f9cde1859398b1a8615bd61ba75672b.html",
        "sha256": "2bd005d9ce671a2605f56d7b75d5f0217f9cde1859398b1a8615bd61ba75672b",
        "git_blob_sha1": "5d890f8ccefb0be028df9ad9cf433f9995aa671d",
        "anchor": "National Cemetery Administration"
      },
      "directory_evidence": {
        "key": "VA-ADMIN-OFFICES",
        "original_url": "https://department.va.gov/administrations-and-offices/",
        "original_path": "evidence/inc17b2b-olrc-119-124/originals/sha256/4a1bdeb313e1a35732d5b2df7cbdb5ebe30647b4b502adfa6daef4b543575edb.html",
        "sha256": "4a1bdeb313e1a35732d5b2df7cbdb5ebe30647b4b502adfa6daef4b543575edb",
        "git_blob_sha1": "5bcf750c6bdda6d4a3bc059496dde386cdea85e7",
        "anchor": "National Cemetery Administration"
      },
      "statute_locator": "38 U.S.C. 301(c)",
      "statute_law_through": "2026-10-15",
      "directory_observed_at": "2026-10-26",
      "legal_effective_from": null,
      "legal_effective_to": null,
      "predecessor_id": null,
      "successor_id": null,
      "historical_aliases": [],
      "directed_membership": {
        "kind": "statutorily_part_of",
        "from": "WG17B2B-SUB-VA-NCA",
        "to": "ORG-FED-EXE-DEP-VA",
        "reverse_query": "has_statutorily_named_constituent",
        "note": "Derived research projection from source text, not an admitted legal edge"
      },
      "qualification": "cross_source_text_and_name_correspondence_only",
      "independent_legal_review": false,
      "canonical_component_id": null,
      "atlas_admitted": false
    },
    {
      "id": "WG17B2C-VA-BVA",
      "name": "Board of Veterans’ Appeals",
      "kind": "organizational_component",
      "role": "adjudicatory_board_not_management_command",
      "jurisdiction": "federal",
      "canonical_parent_id": "ORG-FED-EXE-DEP-VA",
      "source_local_subject_id": "WG17B2B-SUB-VA-BVA",
      "prior_provisional_candidate_id": "DEPT04-UNIT-VA-BVA",
      "statutory_relation_id": "WG17B2B-REL-VA-BVA",
      "publisher_observation_id": "WG17B2B-OBS-VA-BVA",
      "statutory_evidence": {
        "key": "VA-301",
        "original_url": "https://uscode.house.gov/us/usc/119-124/t38/s301/",
        "original_path": "evidence/inc17b2b-olrc-119-124/originals/sha256/2bd005d9ce671a2605f56d7b75d5f0217f9cde1859398b1a8615bd61ba75672b.html",
        "sha256": "2bd005d9ce671a2605f56d7b75d5f0217f9cde1859398b1a8615bd61ba75672b",
        "git_blob_sha1": "5d890f8ccefb0be028df9ad9cf433f9995aa671d",
        "anchor": "Board of Veterans"
      },
      "directory_evidence": {
        "key": "VA-ADMIN-OFFICES",
        "original_url": "https://department.va.gov/administrations-and-offices/",
        "original_path": "evidence/inc17b2b-olrc-119-124/originals/sha256/4a1bdeb313e1a35732d5b2df7cbdb5ebe30647b4b502adfa6daef4b543575edb.html",
        "sha256": "4a1bdeb313e1a35732d5b2df7cbdb5ebe30647b4b502adfa6daef4b543575edb",
        "git_blob_sha1": "5bcf750c6bdda6d4a3bc059496dde386cdea85e7",
        "anchor": "Board of Veterans"
      },
      "statute_locator": "38 U.S.C. 301(c)",
      "statute_law_through": "2026-10-15",
      "directory_observed_at": "2026-10-26",
      "legal_effective_from": null,
      "legal_effective_to": null,
      "predecessor_id": null,
      "successor_id": null,
      "historical_aliases": [],
      "directed_membership": {
        "kind": "statutorily_part_of",
        "from": "WG17B2B-SUB-VA-BVA",
        "to": "ORG-FED-EXE-DEP-VA",
        "reverse_query": "has_statutorily_named_constituent",
        "note": "Derived research projection from source text, not an admitted legal edge"
      },
      "qualification": "cross_source_text_and_name_correspondence_only",
      "independent_legal_review": false,
      "canonical_component_id": null,
      "atlas_admitted": false
    }
  ]
}
